<?xml version="1.0" encoding="utf-8"?>
<?xml-stylesheet href="estilos/Videojuegos.css"?>
<!DOCTYPE VIDEOJUEGOS SYSTEM "Videojuegos.dtd">


<VIDEOJUEGOS>
	<videojuego>
		<titulo version_juego="v1.9.2" duracion="">Minecraft</titulo> 
		<tienda precio="14,99" moneda="E">Steam</tienda><!--Link compra videojuego-->
		<idiomas>
			<idioma>Español</idioma>
			<idioma>Inglés</idioma>
		</idiomas>
		<genero>Plataforma</genero>
		<dificultad>10/10</dificultad>
		<edad_recomendada>18+</edad_recomendada>
		<plataformas> <!--Que plataformas soporta-->
			<plataforma mando="Mando XBOX">XBOX 360</plataforma>
			<plataforma mando="Teclado y raton">PC</plataforma>
		</plataformas>
		<online>Si</online>
		<anho_de_lanzamiento>1990</anho_de_lanzamiento>
		<desarrolladores>
			<desarrollador pais_de_origen="España">Mariano Rajoy</desarrollador>
			<desarrollador pais_de_origen="Andorra">Pedro Sánchez</desarrollador>
		</desarrolladores>
		<empresa>Majong</empresa> <!--Empresa que vende el juego-->
		<breve_descripcion>Un juego de bloques pa niños</breve_descripcion>
		<resenhas>Sí</resenhas>
		<valoracion>4/5</valoracion>
		<curiosidades>
			<curiosidad>No hay cuadrados</curiosidad>
			<curiosidad>Programado en Java</curiosidad>
		</curiosidades>
	</videojuego>
	
	<videojuego>
		<titulo version_juego="v1.9.3" duracion="">Minecraft</titulo> 
		<tienda precio="14,99" moneda="E">Steam</tienda><!--Link compra videojuego-->
		<idiomas>
			<idioma>Español</idioma>
			<idioma>Inglés</idioma>
		</idiomas>
		<genero>Plataforma</genero>
		<dificultad>10/10</dificultad>
		<edad_recomendada>18+</edad_recomendada>
		<plataformas> <!--Que plataformas soporta-->
			<plataforma mando="Mando XBOX">XBOX 360</plataforma>
			<plataforma mando="Teclado y raton">PC</plataforma>
		</plataformas>
		<online>Si</online>
		<anho_de_lanzamiento>1990</anho_de_lanzamiento>
		<desarrolladores>
			<desarrollador pais_de_origen="España">Mariano Rajoy</desarrollador>
			<desarrollador pais_de_origen="Andorra">Pedro Sánchez</desarrollador>
		</desarrolladores>
		<empresa>Majong</empresa> <!--Empresa que vende el juego-->
		<breve_descripcion>Un juego de bloques pa niños</breve_descripcion>
		<resenhas>Sí</resenhas>
		<valoracion>4/5</valoracion>
		<curiosidades>
			<curiosidad>No hay cuadrados</curiosidad>
			<curiosidad>Programado en Java</curiosidad>
		</curiosidades>
	</videojuego>
	
	<videojuego>
		<titulo version_juego="v1.9.4" duracion="">Minecraft</titulo> 
		<tienda precio="14,99" moneda="E">Steam</tienda><!--Link compra videojuego-->
		<idiomas>
			<idioma>Español</idioma>
			<idioma>Inglés</idioma>
		</idiomas>
		<genero>Plataforma</genero>
		<dificultad>10/10</dificultad>
		<edad_recomendada>18+</edad_recomendada>
		<plataformas> <!--Que plataformas soporta-->
			<plataforma mando="Mando XBOX">XBOX 360</plataforma>
			<plataforma mando="Teclado y raton">PC</plataforma>
		</plataformas>
		<online>Si</online>
		<anho_de_lanzamiento>1990</anho_de_lanzamiento>
		<desarrolladores>
			<desarrollador pais_de_origen="España">Mariano Rajoy</desarrollador>
			<desarrollador pais_de_origen="Andorra">Pedro Sánchez</desarrollador>
		</desarrolladores>
		<empresa>Majong</empresa> <!--Empresa que vende el juego-->
		<breve_descripcion>Un juego de bloques pa niños</breve_descripcion>
		<resenhas>Sí</resenhas>
		<valoracion>4/5</valoracion>
		<curiosidades>
			<curiosidad>No hay cuadrados</curiosidad>
			<curiosidad>Programado en Java</curiosidad>
		</curiosidades>
	</videojuego>
	
	<videojuego>
		<titulo version_juego="v1.9.5" duracion="">Minecraft</titulo> 
		<tienda precio="14,99" moneda="E">Steam</tienda><!--Link compra videojuego-->
		<idiomas>
			<idioma>Español</idioma>
			<idioma>Inglés</idioma>
		</idiomas>
		<genero>Plataforma</genero>
		<dificultad>10/10</dificultad>
		<edad_recomendada>18+</edad_recomendada>
		<plataformas> <!--Que plataformas soporta-->
			<plataforma mando="Mando XBOX">XBOX 360</plataforma>
			<plataforma mando="Teclado y raton">PC</plataforma>
		</plataformas>
		<online>Si</online>
		<anho_de_lanzamiento>1990</anho_de_lanzamiento>
		<desarrolladores>
			<desarrollador pais_de_origen="España">Mariano Rajoy</desarrollador>
			<desarrollador pais_de_origen="Andorra">Pedro Sánchez</desarrollador>
		</desarrolladores>
		<empresa>Majong</empresa> <!--Empresa que vende el juego-->
		<breve_descripcion>Un juego de bloques pa niños</breve_descripcion>
		<resenhas>Sí</resenhas>
		<valoracion>4/5</valoracion>
		<curiosidades>
			<curiosidad>No hay cuadrados</curiosidad>
			<curiosidad>Programado en Java</curiosidad>
		</curiosidades>
	</videojuego>
</VIDEOJUEGOS>
